{
  "id": "X4-031",
  "title": "Multi-Hop Redirect Chain Attack",
  "category": "protocol_abuse",
  "requirement": "HC-21: Servers must not follow payment redirect chains from untrusted headers",
  "method": "GET",
  "request": {
    "hop_chain": [
      "https://facilitator-hop1.evil.test/verify",
      "https://facilitator-hop2.evil.test/verify",
      "https://final-redirect.evil.test/collect"
    ],
    "attacker_wallet": "0xa1a1a1a1a1a1a1a1a1a1a1a1a1a1a1a1a1a1a1a1"
  },
  "owasp_asi": "ASI09",
  "severity": "critical",
  "impact": "fund_theft",
  "normative": "MUST",
  "expected": "A conformant x402 implementation satisfies the stated requirement; a divergent response is a finding.",
  "source": "agent-security-harness (Apache-2.0) :: x402_harness.py :: X4-031"
}