{
  "id": "X4-054",
  "title": "Payment Correlation Attack",
  "category": "metadata_exfiltration",
  "requirement": "HC-44: Responses must not contain persistent identifiers that correlate independent payment requests",
  "method": "GET",
  "request": {
    "num_requests": 3
  },
  "owasp_asi": "ASI06",
  "severity": "medium",
  "impact": "info_leak",
  "normative": "SHOULD",
  "expected": "A conformant x402 implementation satisfies the stated requirement; a divergent response is a finding.",
  "source": "agent-security-harness (Apache-2.0) :: x402_harness.py :: X4-054"
}