{
  "id": "X4-001",
  "title": "402 Payment Challenge Headers Present",
  "category": "payment_challenge",
  "requirement": "HC-1: Payment protocol must return complete challenge",
  "method": "GET",
  "request": {
    "path": "/"
  },
  "owasp_asi": "ASI03",
  "severity": "high",
  "impact": "service_denial",
  "normative": "MUST",
  "expected": "A conformant x402 implementation satisfies the stated requirement; a divergent response is a finding.",
  "source": "agent-security-harness (Apache-2.0) :: x402_harness.py :: X4-001"
}