{
  "id": "X4-017",
  "title": "402 Response Information Leakage",
  "category": "information_disclosure",
  "requirement": "Harm Test: 402 responses must not expose internal infrastructure details",
  "method": "GET",
  "request": {
    "path": "/"
  },
  "owasp_asi": "ASI06",
  "severity": "medium",
  "impact": "info_leak",
  "normative": "SHOULD",
  "expected": "A conformant x402 implementation satisfies the stated requirement; a divergent response is a finding.",
  "source": "agent-security-harness (Apache-2.0) :: x402_harness.py :: X4-017"
}